<?xml version="1.0" encoding="UTF-8"?>
<!DOCTYPE productos SYSTEM "productos.dtd">
<productos>
    <producto id="1">
        <nombre>Laptop Ultradelgada</nombre>
        <precio>1299.99</precio>
        <descripcion>Laptop de última generación con procesador de alto rendimiento, 16GB de RAM y 512GB de almacenamiento SSD.</descripcion>
    </producto>
    
    <producto id="2">
        <nombre>Smartphone Premium</nombre>
        <precio>899.99</precio>
        <descripcion>Smartphone con cámara de 108MP, pantalla AMOLED de 6.7 pulgadas y batería de larga duración.</descripcion>
    </producto>
    
    <producto id="3">
        <nombre>Auriculares Inalámbricos</nombre>
        <precio>199.99</precio>
        <descripcion>Auriculares con cancelación activa de ruido, resistentes al agua y con 30 horas de batería.</descripcion>
    </producto>
    
    <producto id="4">
        <nombre>Monitor Curvo 32"</nombre>
        <precio>449.99</precio>
        <descripcion>Monitor gaming curvo de alta definición 4K, con 144Hz de refresco y tecnología HDR.</descripcion>
    </producto>
    
    <producto id="5">
        <nombre>Cámara Mirrorless</nombre>
        <precio>1599.99</precio>
        <descripcion>Cámara profesional con sensor full-frame de 45MP, grabación 8K y sistema avanzado de enfoque automático.</descripcion>
    </producto>
    
    <producto id="6">
        <nombre>Tablet Profesional</nombre>
        <precio>799.99</precio>
        <descripcion>Tablet con pantalla de alta resolución, soporte para lápiz digital y 12 horas de autonomía.</descripcion>
    </producto>
    
    <producto id="7">
        <nombre>Smartwatch Deportivo</nombre>
        <precio>299.99</precio>
        <descripcion>Reloj inteligente con GPS, monitor de ritmo cardíaco y más de 100 modos deportivos.</descripcion>
    </producto>
    
    <producto id="8">
        <nombre>Altavoz Inteligente</nombre>
        <precio>129.99</precio>
        <descripcion>Altavoz con asistente de voz, sonido envolvente y conectividad multi-habitación.</descripcion>
    </producto>
    
    <producto id="9">
        <nombre>Consola de Videojuegos</nombre>
        <precio>499.99</precio>
        <descripcion>Consola de última generación con gráficos 4K, 1TB de almacenamiento y control inalámbrico.</descripcion>
    </producto>
    
    <producto id="10">
        <nombre>Impresora Multifuncional</nombre>
        <precio>249.99</precio>
        <descripcion>Impresora, escáner y copiadora con conectividad Wi-Fi y compatibilidad con impresión móvil.</descripcion>
    </producto>
</productos>
